{
  "task": "评审 RedCap E2E 等价承载层方案，解决 Codex CLI 项目级 Hook 不触发导致 Loom E2E 阻塞的问题。",
  "user_intent": "Norven 要求继续 E2E 巡检循环，发现问题就修复并复测；同时明确禁止绕过、降级或用更弱证据替代真实能力。上轮棱镜复核确认完整 E2E 被 Codex CLI 项目级 Hook 承载缺失阻塞。",
  "main_claim": "方案候选：保留原生 Codex CLI 项目级 Hook 探针作为最高优先级；若原生探针失败，则不直接运行 Loom 角色，而是启用 RedCap 自有的等价承载层。该承载层不伪装成 Codex Hook，而是用 RedCap 运行器显式调度每个 Loom 角色，记录角色 session_id、输入输出、命令收据、阶段状态、失败回流、棱镜协助和收口状态，并让 E2E 的质量检查读取这些证据。若等价承载证据不足，仍保持 blocked。",
  "changed_reality": [
    "当前 carrier_probe 源码要求 command.ok 且所有 required Hook 事件存在才算 ok；目前运行结果是 command.ok=true 但 Hook 事件缺失，因此 probe.ok=false。",
    "E2E 入口当前会在 carrier_probe 失败时阻断，避免继续误跑 Loom 角色。",
    "目标不是放松 Hook 要求，而是在 Codex CLI 原生项目级 Hook 不可用时，实现一个可审计的 RedCap 等价承载层，并明确披露它不是原生 Hook。",
    "等价承载层必须为每个 Loom 角色生成独立 session_id、role_run_receipt、role_artifact、上游输入引用、下游输出引用、动作证据、失败回流和收口状态。",
    "等价承载层必须被 complete-revival-e2e self-check、meaningful evidence check 和最终棱镜复核覆盖。"
  ],
  "evidence": [
    {
      "kind": "document",
      "reference": "assets/evidence/lifecycle/20260618-e2e-carrier-equivalent-lifecycle.json",
      "summary": "本轮生命周期包，明确要求正面修复而非降级。"
    },
    {
      "kind": "diff",
      "reference": "runtime/core/complete_revival_e2e.py",
      "summary": "当前 E2E 入口、carrier_probe、Loom 角色运行和证据检查实现位置。"
    },
    {
      "kind": "document",
      "reference": "assets/evidence/prism/20260618-e2e-patrol-loop-final-review-round2/merge.json",
      "summary": "上轮最终实现复核给出的 block/concern。"
    },
    {
      "kind": "document",
      "reference": "assets/evidence/prism/20260618-e2e-patrol-loop-final-review-round2/resolution.json",
      "summary": "上轮 block 已升级为真实阻塞。"
    }
  ],
  "review_mode": "design_review",
  "risk_level": "high",
  "requested_providers": [
    "kimi",
    "claude-code"
  ],
  "known_constraints": [
    "不得把等价承载层说成原生 Codex Hook。",
    "不得降低 Loom 角色工作流的证据要求。",
    "不得只记录进程开始和结束；必须覆盖角色、会话、动作、阶段、失败和收口。",
    "如果等价承载层无法覆盖关键证据，必须维持 blocked。",
    "评审方如认为方案仍是降级，应给出 block 或 concern。"
  ]
}
