{
  "task": "评审知识召回搜索增强方案，确保下一步 RedCap 风险队列中的 R2-03 不只是固定关键词验收。",
  "user_intent": "Norven 要求回到此前复盘出的风险与待办队列，不能只做 Loom 失败回流和 E2E 产物保留治理。当前复核发现知识网关对自然语言混合查询会漏召回相关经验，这会削弱“知识召回影响任务决策”的目标。",
  "main_claim": "应把知识网关从简单的 all-terms 字符串包含搜索，升级为规范化、别名扩展、分词评分和阈值过滤的宽容搜索；这样既能让任务前检索更像真实用户语言，也不能破坏 index-first 和 raw evidence 默认禁读边界。",
  "changed_reality": [
    "已确认下一步队列是 R2-01 Loom 通用角色运行机、R2-02 自我净化运行闭环、R2-03 知识召回影响任务决策、R2-04 E2E 轻重分层验收。",
    "已运行专门查询：self-purification 和 loom 可以命中知识条目。",
    "已运行混合自然语言查询：loom session continuity self-purification E2E layered acceptance，结果为 0 命中。",
    "尚未修改代码，本请求是实施前评审。"
  ],
  "evidence": [
    {
      "kind": "document",
      "reference": "assets/docs/next-redcap-development-plan.md",
      "summary": "记录 R2-01 到 R2-04 风险与待办队列。"
    },
    {
      "kind": "document",
      "reference": "assets/contracts/next-redcap-development-queue.json",
      "summary": "队列当前标记为 runtime_verified_pre_e2e，但仍保留 second E2E 问题。"
    },
    {
      "kind": "log",
      "reference": "assets/evidence/self-purification/20260620-knowledge-recall-search-hardening/knowledge-retrieval-evidence.json",
      "summary": "记录混合自然语言查询漏召回现象。"
    }
  ],
  "review_mode": "design_review",
  "risk_level": "medium",
  "requested_providers": [
    "kimi",
    "claude-code"
  ],
  "known_constraints": [
    "不得把搜索放宽成无关条目泛滥。",
    "不得读取正文或 raw evidence 作为默认搜索来源；仍必须 index-first。",
    "不得把二次完整 E2E 说成已完成。",
    "实现要有自检和负向样例，不允许只改算法无测试。"
  ]
}
