{
  "task": "评审 RedCap 当前复活收口是否可以进入正式可用版本记录。",
  "user_intent": "Norven 要求 Cap 重新开始执行 RedCap 复活计划，直到 RedCap 达到“正式可用”或“完整复活”为止。",
  "main_claim": "当前 RedCap 已达到正式可用候选：360 度旧 RedCap 扫描已合并，复活实施队列与正式可用检查通过；本轮只需收口未提交的基建修复、补齐当前任务生命周期包、提交并推送 develop 分支。",
  "changed_reality": [
    "当前工作区在 develop 分支，远端为 origin/develop。",
    "未提交修改集中在停止前检查误伤收敛、中文优先输出策略、提示意图判断、Codex 宿主门禁适配器和棱镜调度器。",
    "runtime/bin/redcap status --json --require-scan-complete --fail-on-open 已通过，显示 360 度扫描完成、任务事实开放项为 0。",
    "runtime/bin/redcap revival-queue check 已通过，显示全部正式可用必需队列项 verified。",
    "runtime/bin/redcap formal-usable-check 已通过。",
    "runtime/bin/redcap check 已完整通过，包含宿主门禁审计、棱镜调度器、超时治理、生命周期、完成声明、旧 RedCap 考古、状态面、Cap 加载和目录边界。",
    "带旧生命周期包的规则评审失败，原因是 prompt_context.continuation_authorization.base_prompt_excerpt 不匹配最新用户提示；本轮需要新增当前任务专用生命周期包后再收口。"
  ],
  "evidence": [
    {
      "kind": "diff",
      "reference": "git diff --stat",
      "summary": "7 个文件、约 413 行新增，覆盖停止前检查、意图判断、中文输出策略和棱镜调度器。"
    },
    {
      "kind": "test",
      "reference": "runtime/bin/redcap check",
      "summary": "全量检查退出码为 0。"
    },
    {
      "kind": "test",
      "reference": "runtime/bin/redcap formal-usable-check",
      "summary": "正式可用检查退出码为 0。"
    },
    {
      "kind": "test",
      "reference": "runtime/bin/redcap revival-queue check",
      "summary": "复活实施队列检查退出码为 0。"
    },
    {
      "kind": "test",
      "reference": "runtime/bin/redcap status --json --require-scan-complete --fail-on-open",
      "summary": "状态面检查退出码为 0，360 度扫描已完成。"
    },
    {
      "kind": "log",
      "reference": "runtime/bin/redcap gate --task ... --risk-level high --lifecycle-packet assets/evidence/lifecycle/redcap-continuous-revival-goal-audit-lifecycle.json",
      "summary": "旧生命周期包校验失败，暴露当前任务锚点需要更新。"
    }
  ],
  "review_mode": "completion_review",
  "risk_level": "high",
  "requested_providers": [
    "kimi",
    "claude-code"
  ],
  "known_constraints": [
    "不要把计划、报告、账目、回执或版本记录单独当作完成。",
    "不得批量读取旧 RedCap 仓库。",
    "必须保留防空转能力，同时降低停止前检查误伤。",
    "棱镜只是异构评审助手，Cap 必须评审其意见，不能盲从。",
    "如果仍有必须修的基建问题，应先修复再做正式可用收口。"
  ]
}
